Title,Year,Rated,Released,Runtime,Genre,Director,Writer,Actors,Plot,Language,Country,Awards,Poster,Ratings,Metascore,imdbRating,imdbVotes,imdbID,Type,DVD,BoxOffice,Production,Website,Response,totalSeasons
Iron Man,2008,PG-13,02-May-08,126 min,"Action, Adventure, Sci-Fi",Jon Favreau,"Mark Fergus (screenplay), Hawk Ostby (screenplay), Art Marcum (screenplay), Matt Holloway (screenplay), Stan Lee (characters), Don Heck (characters), Larry Lieber (characters), Jack Kirby (characters)","Robert Downey Jr., Terrence Howard, Jeff Bridges, Gwyneth Paltrow","After being held captive in an Afghan cave, billionaire engineer Tony Stark creates a unique weaponized suit of armor to fight evil.","English, Persian, Urdu, Arabic, Kurdish, Hindi, Hungarian","USA, Canada",Nominated for 2 Oscars. Another 22 wins & 70 nominations.,https://m.media-amazon.com/images/M/MV5BMTczNTI2ODUwOF5BMl5BanBnXkFtZTcwMTU0NTIzMw@@._V1_SX300.jpg,"[{'Source': 'Internet Movie Database', 'Value': '7.9/10'}, {'Source': 'Rotten Tomatoes', 'Value': '94%'}, {'Source': 'Metacritic', 'Value': '79/100'}]",79,7.9,"9,30,966",tt0371746,movie,N/A,N/A,"Marvel Enterprises, Paramount",N/A,TRUE,
The Incredible Hulk,2008,PG-13,13-Jun-08,112 min,"Action, Adventure, Sci-Fi",Louis Leterrier,"Zak Penn (screenplay), Zak Penn (screen story), Stan Lee (Marvel comic book), Jack Kirby (Marvel comic book)","Edward Norton, Liv Tyler, Tim Roth, William Hurt","Bruce Banner, a scientist on the run from the U.S. Government, must find a cure for the monster he turns into whenever he loses his temper.","English, Portuguese, Spanish",USA,1 win & 10 nominations.,https://m.media-amazon.com/images/M/MV5BMTUyNzk3MjA1OF5BMl5BanBnXkFtZTcwMTE1Njg2MQ@@._V1_SX300.jpg,"[{'Source': 'Internet Movie Database', 'Value': '6.7/10'}, {'Source': 'Rotten Tomatoes', 'Value': '67%'}, {'Source': 'Metacritic', 'Value': '61/100'}]",61,6.7,"4,30,679",tt0800080,movie,N/A,"$134,806,913","Marvel Films, Valhalla Motion Pictures",N/A,TRUE,
Iron Man 2,2010,PG-13,07-May-10,124 min,"Action, Adventure, Sci-Fi",Jon Favreau,"Justin Theroux (screenplay), Stan Lee (Marvel comic book), Don Heck (Marvel comic book), Larry Lieber (Marvel comic book), Jack Kirby (Marvel comic book)","Robert Downey Jr., Gwyneth Paltrow, Don Cheadle, Scarlett Johansson","With the world now aware of his identity as Iron Man, Tony Stark must contend with both his declining health and a vengeful mad man with ties to his father's legacy.","English, French, Russian",USA,Nominated for 1 Oscar. Another 7 wins & 43 nominations.,https://m.media-amazon.com/images/M/MV5BMTM0MDgwNjMyMl5BMl5BanBnXkFtZTcwNTg3NzAzMw@@._V1_SX300.jpg,"[{'Source': 'Internet Movie Database', 'Value': '7.0/10'}, {'Source': 'Rotten Tomatoes', 'Value': '72%'}, {'Source': 'Metacritic', 'Value': '57/100'}]",57,7,"7,13,108",tt1228705,movie,N/A,N/A,Marvel Studios,N/A,TRUE,
Thor,2011,PG-13,06-May-11,115 min,"Action, Adventure, Fantasy",Kenneth Branagh,"Ashley Miller (screenplay), Zack Stentz (screenplay), Don Payne (screenplay), J. Michael Straczynski (story), Mark Protosevich (story), Stan Lee (comic book), Larry Lieber (comic book), Jack Kirby (comic book)","Chris Hemsworth, Natalie Portman, Tom Hiddleston, Anthony Hopkins","The powerful but arrogant god Thor is cast out of Asgard to live amongst humans in Midgard (Earth), where he soon becomes one of their finest defenders.",English,USA,5 wins & 30 nominations.,https://m.media-amazon.com/images/M/MV5BOGE4NzU1YTAtNzA3Mi00ZTA2LTg2YmYtMDJmMThiMjlkYjg2XkEyXkFqcGdeQXVyNTgzMDMzMTg@._V1_SX300.jpg,"[{'Source': 'Internet Movie Database', 'Value': '7.0/10'}, {'Source': 'Rotten Tomatoes', 'Value': '77%'}, {'Source': 'Metacritic', 'Value': '57/100'}]",57,7,"7,40,509",tt0800369,movie,N/A,"$181,030,624",Marvel Studios,N/A,TRUE,
Captain America: The First Avenger,2011,PG-13,22-Jul-11,124 min,"Action, Adventure, Sci-Fi",Joe Johnston,"Christopher Markus (screenplay), Stephen McFeely (screenplay), Joe Simon (comic books), Jack Kirby (comic books)","Chris Evans, Hayley Atwell, Sebastian Stan, Tommy Lee Jones","Steve Rogers, a rejected military soldier, transforms into Captain America after taking a dose of a ""Super-Soldier serum"". But being Captain America comes at a price as he attempts to take down a war monger and a terrorist organization.","English, Norwegian, French",USA,4 wins & 46 nominations.,https://m.media-amazon.com/images/M/MV5BMTYzOTc2NzU3N15BMl5BanBnXkFtZTcwNjY3MDE3NQ@@._V1_SX300.jpg,"[{'Source': 'Internet Movie Database', 'Value': '6.9/10'}, {'Source': 'Rotten Tomatoes', 'Value': '80%'}, {'Source': 'Metacritic', 'Value': '66/100'}]",66,6.9,"7,32,650",tt0458339,movie,N/A,N/A,Marvel Enterprises,N/A,TRUE,
Avengers Assemble,2013–,TV-Y7,26-May-13,23 min,"Animation, Action, Adventure, Sci-Fi",N/A,"Jack Kirby, Joe Simon, Stan Lee","Roger Craig Smith, Troy Baker, Fred Tatasciore, Travis Willingham",The further adventures of the Marvel Universe's mightiest general membership superhero team.,English,USA,11 nominations.,https://m.media-amazon.com/images/M/MV5BMTY0NTUyMDQwOV5BMl5BanBnXkFtZTgwNjAwMTA0MDE@._V1_SX300.jpg,"[{'Source': 'Internet Movie Database', 'Value': '7.0/10'}]",N/A,7,"6,493",tt2455546,series,,,,,TRUE,5
Iron Man 3,2013,PG-13,03-May-13,130 min,"Action, Adventure, Sci-Fi",Shane Black,"Drew Pearce (screenplay by), Shane Black (screenplay by), Stan Lee (based on the Marvel comic book by), Don Heck (based on the Marvel comic book by), Larry Lieber (based on the Marvel comic book by), Jack Kirby (based on the Marvel comic book by), Warren Ellis (based on the ""Extremis"" mini-series written by), Adi Granov (based on the ""Extremis"" mini-series illustrated by)","Robert Downey Jr., Gwyneth Paltrow, Don Cheadle, Guy Pearce","When Tony Stark's world is torn apart by a formidable terrorist called the Mandarin, he starts an odyssey of rebuilding and retribution.",English,USA,Nominated for 1 Oscar. Another 20 wins & 62 nominations.,https://m.media-amazon.com/images/M/MV5BMjE5MzcyNjk1M15BMl5BanBnXkFtZTcwMjQ4MjcxOQ@@._V1_SX300.jpg,"[{'Source': 'Internet Movie Database', 'Value': '7.2/10'}, {'Source': 'Rotten Tomatoes', 'Value': '79%'}, {'Source': 'Metacritic', 'Value': '62/100'}]",62,7.2,"7,48,737",tt1300854,movie,N/A,"$409,013,994",Marvel Studios,N/A,TRUE,
Thor: The Dark World,2013,PG-13,08-Nov-13,112 min,"Action, Adventure, Fantasy",Alan Taylor,"Christopher L. Yost (screenplay by), Christopher Markus (screenplay by), Stephen McFeely (screenplay by), Don Payne (story by), Robert Rodat (story by), Stan Lee (based on the Marvel comics by), Larry Lieber (based on the Marvel comics by), Jack Kirby (based on the Marvel comics by), Walter Simonson (character created by: Malekith)","Chris Hemsworth, Natalie Portman, Tom Hiddleston, Anthony Hopkins","When the Dark Elves attempt to plunge the universe into darkness, Thor must embark on a perilous and personal journey that will reunite him with doctor Jane Foster.",English,USA,3 wins & 21 nominations.,https://m.media-amazon.com/images/M/MV5BMTQyNzAwOTUxOF5BMl5BanBnXkFtZTcwMTE0OTc5OQ@@._V1_SX300.jpg,"[{'Source': 'Internet Movie Database', 'Value': '6.9/10'}, {'Source': 'Rotten Tomatoes', 'Value': '66%'}, {'Source': 'Metacritic', 'Value': '54/100'}]",54,6.9,"5,87,843",tt1981115,movie,N/A,N/A,Marvel Studios,N/A,TRUE,
Captain America: The Winter Soldier,2014,PG-13,04-Apr-14,136 min,"Action, Adventure, Sci-Fi, Thriller","Anthony Russo, Joe Russo","Christopher Markus (screenplay by), Stephen McFeely (screenplay by), Joe Simon (based on the Marvel comics by), Jack Kirby (based on the Marvel comics by)","Chris Evans, Samuel L. Jackson, Scarlett Johansson, Robert Redford","As Steve Rogers struggles to embrace his role in the modern world, he teams up with a fellow Avenger and S.H.I.E.L.D agent, Black Widow, to battle a new threat from history: an assassin known as the Winter Soldier.","English, French",USA,Nominated for 1 Oscar. Another 5 wins & 50 nominations.,https://m.media-amazon.com/images/M/MV5BMzA2NDkwODAwM15BMl5BanBnXkFtZTgwODk5MTgzMTE@._V1_SX300.jpg,"[{'Source': 'Internet Movie Database', 'Value': '7.7/10'}, {'Source': 'Rotten Tomatoes', 'Value': '90%'}, {'Source': 'Metacritic', 'Value': '70/100'}]",70,7.7,"7,28,693",tt1843866,movie,N/A,N/A,Marvel Enterprises,N/A,TRUE,
Guardians of the Galaxy,2014,PG-13,01-Aug-14,121 min,"Action, Adventure, Comedy, Sci-Fi",James Gunn,"James Gunn, Nicole Perlman, Dan Abnett (based on the Marvel comics by), Andy Lanning (based on the Marvel comics by), Bill Mantlo (character created by: Rocket Raccoon), Keith Giffen (character created by: Rocket Raccoon), Jim Starlin (characters created by: Drax the Destroyer,  Gamora & Thanos), Steve Englehart (character created by: Star-Lord), Steve Gan (character created by: Star-Lord), Steve Gerber (character created by: Howard the Duck), Val Mayerik (character created by: Howard the Duck)","Chris Pratt, Zoe Saldana, Dave Bautista, Vin Diesel",A group of intergalactic criminals must pull together to stop a fanatical warrior with plans to purge the universe.,English,USA,Nominated for 2 Oscars. Another 52 wins & 100 nominations.,https://m.media-amazon.com/images/M/MV5BMTAwMjU5OTgxNjZeQTJeQWpwZ15BbWU4MDUxNDYxODEx._V1_SX300.jpg,"[{'Source': 'Internet Movie Database', 'Value': '8.0/10'}, {'Source': 'Rotten Tomatoes', 'Value': '91%'}, {'Source': 'Metacritic', 'Value': '76/100'}]",76,8,"10,35,000",tt2015381,movie,N/A,"$333,718,600","Marvel Studios, Moving Picture Company, Marvel Enterprises",N/A,TRUE,
Avengers: Age of Ultron,2015,PG-13,01-May-15,141 min,"Action, Adventure, Sci-Fi",Joss Whedon,"Joss Whedon, Stan Lee (based on the Marvel comics by), Jack Kirby (based on the Marvel comics by), Joe Simon (character created by: Captain America), Jack Kirby (character created by: Captain America), Jim Starlin (character created by: Thanos)","Robert Downey Jr., Chris Hemsworth, Mark Ruffalo, Chris Evans","When Tony Stark and Bruce Banner try to jump-start a dormant peacekeeping program called Ultron, things go horribly wrong and it's up to Earth's mightiest heroes to stop the villainous Ultron from enacting his terrible plan.","English, Korean",USA,8 wins & 47 nominations.,https://m.media-amazon.com/images/M/MV5BMTM4OGJmNWMtOTM4Ni00NTE3LTg3MDItZmQxYjc4N2JhNmUxXkEyXkFqcGdeQXVyNTgzMDMzMTg@._V1_SX300.jpg,"[{'Source': 'Internet Movie Database', 'Value': '7.3/10'}, {'Source': 'Rotten Tomatoes', 'Value': '76%'}, {'Source': 'Metacritic', 'Value': '66/100'}]",66,7.3,"7,31,508",tt2395427,movie,N/A,N/A,Marvel Studios,N/A,TRUE,
Ant-Man,2015,PG-13,17-Jul-15,117 min,"Action, Adventure, Comedy, Sci-Fi",Peyton Reed,"Edgar Wright (screenplay by), Joe Cornish (screenplay by), Adam McKay (screenplay by), Paul Rudd (screenplay by), Edgar Wright (story by), Joe Cornish (story by), Stan Lee (based on the Marvel comics by), Larry Lieber (based on the Marvel comics by), Jack Kirby (based on the Marvel comics by)","Paul Rudd, Michael Douglas, Evangeline Lilly, Corey Stoll","Armed with a super-suit with the astonishing ability to shrink in scale but increase in strength, cat burglar Scott Lang must embrace his inner hero and help his mentor, Dr. Hank Pym, plan and pull off a heist that will save the world.",English,USA,Nominated for 1 BAFTA Film Award. Another 4 wins & 33 nominations.,https://m.media-amazon.com/images/M/MV5BMjM2NTQ5Mzc2M15BMl5BanBnXkFtZTgwNTcxMDI2NTE@._V1_SX300.jpg,"[{'Source': 'Internet Movie Database', 'Value': '7.3/10'}, {'Source': 'Rotten Tomatoes', 'Value': '83%'}, {'Source': 'Metacritic', 'Value': '64/100'}]",64,7.3,"5,63,285",tt0478970,movie,N/A,"$180,202,163",Marvel Studios,N/A,TRUE,
Captain America: Civil War,2016,PG-13,06-May-16,147 min,"Action, Adventure, Sci-Fi","Anthony Russo, Joe Russo","Christopher Markus (screenplay by), Stephen McFeely (screenplay by), Joe Simon (based on the Marvel comics by), Jack Kirby (based on the Marvel comics by)","Chris Evans, Robert Downey Jr., Scarlett Johansson, Sebastian Stan",Political involvement in the Avengers' affairs causes a rift between Captain America and Iron Man.,"English, German, Xhosa, Russian, Romanian, Hindi",USA,16 wins & 68 nominations.,https://m.media-amazon.com/images/M/MV5BMjQ0MTgyNjAxMV5BMl5BanBnXkFtZTgwNjUzMDkyODE@._V1_SX300.jpg,"[{'Source': 'Internet Movie Database', 'Value': '7.8/10'}, {'Source': 'Rotten Tomatoes', 'Value': '90%'}, {'Source': 'Metacritic', 'Value': '75/100'}]",75,7.8,"6,55,365",tt3498820,movie,N/A,N/A,Marvel Studios,N/A,TRUE,
Doctor Strange,2016,PG-13,04-Nov-16,115 min,"Action, Adventure, Fantasy, Sci-Fi",Scott Derrickson,"Jon Spaihts, Scott Derrickson, C. Robert Cargill, Stan Lee (based on the Marvel comics by), Steve Ditko (based on the Marvel comics by)","Benedict Cumberbatch, Chiwetel Ejiofor, Rachel McAdams, Benedict Wong","While on a journey of physical and spiritual healing, a brilliant neurosurgeon is drawn into the world of the mystic arts.",English,USA,Nominated for 1 Oscar. Another 20 wins & 66 nominations.,https://m.media-amazon.com/images/M/MV5BNjgwNzAzNjk1Nl5BMl5BanBnXkFtZTgwMzQ2NjI1OTE@._V1_SX300.jpg,"[{'Source': 'Internet Movie Database', 'Value': '7.5/10'}, {'Source': 'Rotten Tomatoes', 'Value': '89%'}, {'Source': 'Metacritic', 'Value': '72/100'}]",72,7.5,"5,89,860",tt1211837,movie,N/A,N/A,"Marvel Studios, Marvel Entertainment",N/A,TRUE,
Guardians of the Galaxy Vol. 2,2017,PG-13,05-May-17,136 min,"Action, Adventure, Comedy, Sci-Fi",James Gunn,"James Gunn, Dan Abnett (based on the Marvel comics by), Andy Lanning (based on the Marvel comics by), Steve Englehart (Star-Lord created by), Steve Gan (Star-Lord created by), Jim Starlin (Gamora and Drax created by), Stan Lee (Groot created by), Larry Lieber (Groot created by), Jack Kirby (Groot created by), Bill Mantlo (Rocket Raccoon created by), Keith Giffen (Rocket Raccoon created by), Steve Gerber (Howard the Duck created by), Val Mayerik (Howard the Duck created by)","Chris Pratt, Zoe Saldana, Dave Bautista, Vin Diesel","The Guardians struggle to keep together as a team while dealing with their personal family issues, notably Star-Lord's encounter with his father the ambitious celestial being Ego.",English,USA,Nominated for 1 Oscar. Another 15 wins & 57 nominations.,https://m.media-amazon.com/images/M/MV5BNjM0NTc0NzItM2FlYS00YzEwLWE0YmUtNTA2ZWIzODc2OTgxXkEyXkFqcGdeQXVyNTgwNzIyNzg@._V1_SX300.jpg,"[{'Source': 'Internet Movie Database', 'Value': '7.6/10'}, {'Source': 'Rotten Tomatoes', 'Value': '85%'}, {'Source': 'Metacritic', 'Value': '67/100'}]",67,7.6,"5,59,889",tt3896198,movie,N/A,N/A,"Marvel Studios, Walt Disney Pictures",N/A,TRUE,
Spider-Man: Homecoming,2017,PG-13,07-Jul-17,133 min,"Action, Adventure, Sci-Fi",Jon Watts,"Jonathan Goldstein (screenplay by), John Francis Daley (screenplay by), Jon Watts (screenplay by), Christopher Ford (screenplay by), Chris McKenna (screenplay by), Erik Sommers (screenplay by), Jonathan Goldstein (screen story by), John Francis Daley (screen story by), Stan Lee (based on the Marvel comic book by), Steve Ditko (based on the Marvel comic book by), Joe Simon (Captain America created by), Jack Kirby (Captain America created by)","Tom Holland, Michael Keaton, Robert Downey Jr., Marisa Tomei","Peter Parker balances his life as an ordinary high school student in Queens with his superhero alter-ego Spider-Man, and finds himself on the trail of a new menace prowling the skies of New York City.","English, Spanish",USA,7 wins & 10 nominations.,https://m.media-amazon.com/images/M/MV5BNTk4ODQ1MzgzNl5BMl5BanBnXkFtZTgwMTMyMzM4MTI@._V1_SX300.jpg,"[{'Source': 'Internet Movie Database', 'Value': '7.4/10'}, {'Source': 'Rotten Tomatoes', 'Value': '92%'}, {'Source': 'Metacritic', 'Value': '73/100'}]",73,7.4,"5,04,737",tt2250912,movie,N/A,"$334,201,140","Columbia Pictures, Marvel Studios",N/A,TRUE,
Thor: Ragnarok,2017,PG-13,03-Nov-17,130 min,"Action, Adventure, Comedy, Fantasy, Sci-Fi",Taika Waititi,"Eric Pearson, Craig Kyle, Christopher L. Yost, Stan Lee (based on the Marvel comics by), Larry Lieber (based on the Marvel comics by), Jack Kirby (based on the Marvel comics by)","Chris Hemsworth, Tom Hiddleston, Cate Blanchett, Idris Elba","Imprisoned on the planet Sakaar, Thor must race against time to return to Asgard and stop Ragnarök, the destruction of his world, at the hands of the powerful and ruthless villain Hela.",English,"USA, Australia",6 wins & 50 nominations.,https://m.media-amazon.com/images/M/MV5BMjMyNDkzMzI1OF5BMl5BanBnXkFtZTgwODcxODg5MjI@._V1_SX300.jpg,"[{'Source': 'Internet Movie Database', 'Value': '7.9/10'}, {'Source': 'Rotten Tomatoes', 'Value': '93%'}, {'Source': 'Metacritic', 'Value': '74/100'}]",74,7.9,"5,77,552",tt3501632,movie,N/A,N/A,Marvel Studios,N/A,TRUE,
Black Panther,2018,PG-13,16-Feb-18,134 min,"Action, Adventure, Sci-Fi",Ryan Coogler,"Ryan Coogler, Joe Robert Cole, Stan Lee (based on the Marvel comics by), Jack Kirby (based on the Marvel Comics by)","Chadwick Boseman, Michael B. Jordan, Lupita Nyong'o, Danai Gurira","T'Challa, heir to the hidden but advanced kingdom of Wakanda, must step forward to lead his people into a new future and must confront a challenger from his country's past.","English, Swahili, Nama, Xhosa, Korean",USA,Won 3 Oscars. Another 110 wins & 268 nominations.,https://m.media-amazon.com/images/M/MV5BMTg1MTY2MjYzNV5BMl5BanBnXkFtZTgwMTc4NTMwNDI@._V1_SX300.jpg,"[{'Source': 'Internet Movie Database', 'Value': '7.3/10'}, {'Source': 'Rotten Tomatoes', 'Value': '97%'}, {'Source': 'Metacritic', 'Value': '88/100'}]",88,7.3,"6,17,338",tt1825683,movie,N/A,"$700,426,566",Walt Disney Pictures,N/A,TRUE,
Avengers: Infinity War,2018,PG-13,27-Apr-18,149 min,"Action, Adventure, Sci-Fi","Anthony Russo, Joe Russo","Christopher Markus (screenplay by), Stephen McFeely (screenplay by), Stan Lee (based on the Marvel comics by), Jack Kirby (based on the Marvel comics by), Joe Simon (Captain America created by), Jack Kirby (Captain America created by), Steve Englehart (Star-Lord created by), Steve Gan (Star-Lord created by), Bill Mantlo (Rocket Raccoon created by), Keith Giffen (Rocket Raccoon created by), Jim Starlin (Thanos,  Gamora and Drax created by), Stan Lee (Groot created by), Larry Lieber (Groot created by), Jack Kirby (Groot created by), Steve Englehart (Mantis created by), Don Heck (Mantis created by)","Robert Downey Jr., Chris Hemsworth, Mark Ruffalo, Chris Evans",The Avengers and their allies must be willing to sacrifice all in an attempt to defeat the powerful Thanos before his blitz of devastation and ruin puts an end to the universe.,English,USA,Nominated for 1 Oscar. Another 46 wins & 75 nominations.,https://m.media-amazon.com/images/M/MV5BMjMxNjY2MDU1OV5BMl5BanBnXkFtZTgwNzY1MTUwNTM@._V1_SX300.jpg,"[{'Source': 'Internet Movie Database', 'Value': '8.4/10'}, {'Source': 'Rotten Tomatoes', 'Value': '85%'}, {'Source': 'Metacritic', 'Value': '68/100'}]",68,8.4,"8,19,170",tt4154756,movie,N/A,"$678,815,482",Marvel Studios,N/A,TRUE,
Ant-Man and the Wasp,2018,PG-13,06-Jul-18,118 min,"Action, Adventure, Comedy, Sci-Fi",Peyton Reed,"Chris McKenna, Erik Sommers, Paul Rudd, Andrew Barrer, Gabriel Ferrari, Stan Lee (based on the Marvel Comics by), Larry Lieber (based on the Marvel Comics by), Jack Kirby (based on the Marvel Comics by)","Paul Rudd, Evangeline Lilly, Michael Peña, Walton Goggins","As Scott Lang balances being both a superhero and a father, Hope van Dyne and Dr. Hank Pym present an urgent new mission that finds the Ant-Man fighting alongside The Wasp to uncover secrets from their past.","English, Spanish",USA,19 nominations.,https://m.media-amazon.com/images/M/MV5BYjcyYTk0N2YtMzc4ZC00Y2E0LWFkNDgtNjE1MzZmMGE1YjY1XkEyXkFqcGdeQXVyMTMxODk2OTU@._V1_SX300.jpg,"[{'Source': 'Internet Movie Database', 'Value': '7.1/10'}, {'Source': 'Rotten Tomatoes', 'Value': '87%'}, {'Source': 'Metacritic', 'Value': '70/100'}]",70,7.1,"3,03,351",tt5095030,movie,N/A,N/A,Marvel Studios,N/A,TRUE,
Captain Marvel,2019,PG-13,08-Mar-19,123 min,"Action, Adventure, Sci-Fi","Anna Boden, Ryan Fleck","Anna Boden (screenplay by), Ryan Fleck (screenplay by), Geneva Robertson-Dworet (screenplay by), Nicole Perlman (story by), Meg LeFauve (story by), Anna Boden (story by), Ryan Fleck (story by), Geneva Robertson-Dworet (story by)","Brie Larson, Samuel L. Jackson, Ben Mendelsohn, Jude Law",Carol Danvers becomes one of the universe's most powerful heroes when Earth is caught in the middle of a galactic war between two alien races.,English,"USA, Australia",8 wins & 48 nominations.,https://m.media-amazon.com/images/M/MV5BMTE0YWFmOTMtYTU2ZS00ZTIxLWE3OTEtYTNiYzBkZjViZThiXkEyXkFqcGdeQXVyODMzMzQ4OTI@._V1_SX300.jpg,"[{'Source': 'Internet Movie Database', 'Value': '6.9/10'}, {'Source': 'Rotten Tomatoes', 'Value': '79%'}, {'Source': 'Metacritic', 'Value': '64/100'}]",64,6.9,"4,32,789",tt4154664,movie,N/A,"$426,829,839",Marvel Studios,N/A,TRUE,
Avengers: Endgame,2019,PG-13,26-Apr-19,181 min,"Action, Adventure, Drama, Sci-Fi","Anthony Russo, Joe Russo","Christopher Markus (screenplay by), Stephen McFeely (screenplay by), Stan Lee (based on the Marvel comics by), Jack Kirby (based on the Marvel comics by), Joe Simon (Captain America created by), Jack Kirby (Captain America created by), Steve Englehart (Star-Lord created by), Steve Gan (Star-Lord created by), Bill Mantlo (Rocket Raccoon created by), Keith Giffen (Rocket Raccoon created by), Jim Starlin (Thanos,  Gamora & Drax created by), Stan Lee (Groot created by), Larry Lieber (Groot created by), Jack Kirby (Groot created by), Steve Englehart (Mantis created by), Don Heck (Mantis created by)","Robert Downey Jr., Chris Evans, Mark Ruffalo, Chris Hemsworth","After the devastating events of Avengers: Infinity War (2018), the universe is in ruins. With the help of remaining allies, the Avengers assemble once more in order to reverse Thanos' actions and restore balance to the universe.","English, Japanese, Xhosa, German",USA,Nominated for 1 Oscar. Another 68 wins & 104 nominations.,https://m.media-amazon.com/images/M/MV5BMTc5MDE2ODcwNV5BMl5BanBnXkFtZTgwMzI2NzQ2NzM@._V1_SX300.jpg,"[{'Source': 'Internet Movie Database', 'Value': '8.4/10'}, {'Source': 'Rotten Tomatoes', 'Value': '94%'}, {'Source': 'Metacritic', 'Value': '78/100'}]",78,8.4,"7,87,075",tt4154796,movie,N/A,"$858,373,000","Marvel Studios, Walt Disney Pictures",N/A,TRUE,
Spider-Man: Far from Home,2019,PG-13,02-Jul-19,129 min,"Action, Adventure, Sci-Fi",Jon Watts,"Chris McKenna, Erik Sommers, Stan Lee (based on the Marvel comic book by), Steve Ditko (based on the Marvel comic book by)","Tom Holland, Samuel L. Jackson, Jake Gyllenhaal, Marisa Tomei","Following the events of Avengers: Endgame (2019), Spider-Man must step up to take on new threats in a world that has changed forever.","English, Italian, Czech",USA,10 wins & 22 nominations.,https://m.media-amazon.com/images/M/MV5BMGZlNTY1ZWUtYTMzNC00ZjUyLWE0MjQtMTMxN2E3ODYxMWVmXkEyXkFqcGdeQXVyMDM2NDM2MQ@@._V1_SX300.jpg,"[{'Source': 'Internet Movie Database', 'Value': '7.5/10'}, {'Source': 'Rotten Tomatoes', 'Value': '91%'}, {'Source': 'Metacritic', 'Value': '69/100'}]",69,7.5,"3,15,435",tt6320628,movie,N/A,N/A,"Columbia Pictures, Pascal Pictures, Marvel Studios",N/A,TRUE,
Guardians of the Galaxy Vol. 2,2017,PG-13,05-May-17,136 min,"Action, Adventure, Comedy, Sci-Fi",James Gunn,"James Gunn, Dan Abnett (based on the Marvel comics by), Andy Lanning (based on the Marvel comics by), Steve Englehart (Star-Lord created by), Steve Gan (Star-Lord created by), Jim Starlin (Gamora and Drax created by), Stan Lee (Groot created by), Larry Lieber (Groot created by), Jack Kirby (Groot created by), Bill Mantlo (Rocket Raccoon created by), Keith Giffen (Rocket Raccoon created by), Steve Gerber (Howard the Duck created by), Val Mayerik (Howard the Duck created by)","Chris Pratt, Zoe Saldana, Dave Bautista, Vin Diesel","The Guardians struggle to keep together as a team while dealing with their personal family issues, notably Star-Lord's encounter with his father the ambitious celestial being Ego.",English,USA,Nominated for 1 Oscar. Another 15 wins & 57 nominations.,https://m.media-amazon.com/images/M/MV5BNjM0NTc0NzItM2FlYS00YzEwLWE0YmUtNTA2ZWIzODc2OTgxXkEyXkFqcGdeQXVyNTgwNzIyNzg@._V1_SX300.jpg,"[{'Source': 'Internet Movie Database', 'Value': '7.6/10'}, {'Source': 'Rotten Tomatoes', 'Value': '85%'}, {'Source': 'Metacritic', 'Value': '67/100'}]",67,7.6,"5,59,889",tt3896198,movie,N/A,N/A,"Marvel Studios, Walt Disney Pictures",N/A,TRUE,